{
  "schema_version": 1,
  "adr": "ADR-SHARED-036",
  "ea_plan": "EA-v2.2",
  "harness": "L4-00",
  "classification": "REAL_COMPONENT_SYNTHETIC_DATA",
  "provenance": {
    "shared": "4030b2744b5567b4ce8136b431d206334cc7b9e5",
    "infrastructure": "a7e5b842b87060695fa7ac47b0d2106e0a0a2331",
    "baobab-iam": "49aa42c93164050fc9421e7978d3866df9bef99c",
    "baobab-cp": "8c129a16912cb7a2d90b0ccfbaab420aafcdb47b",
    "nabhold": "09425a818b8a7f032c146088c2f58d64a8e86147"
  },
  "foundation_images": {
    "postgres": {
      "tag": "postgres:17.11-alpine3.24",
      "digest": "sha256:b0f9560a2de083e2cc7382e75f808c7381a32852a7ec49117deedb300e552b24"
    },
    "rabbitmq": {
      "tag": "rabbitmq:4.3.5-management-alpine",
      "digest": "sha256:b3b8b7f95f5382a19f9ea33540e604f30aad081d37ad9aba72255135765373a1"
    },
    "redis": {
      "tag": "redis:7.4.11-alpine",
      "digest": "sha256:858f009f9709ce576febc734aa78b8f6d624b82571f9ddb6bda4377c833b3499"
    }
  },
  "profiles": {
    "foundation": {
      "services": [
        "postgres",
        "rabbitmq",
        "redis"
      ],
      "mandatory": [
        "L4-MAN-01",
        "L4-MAN-02",
        "L4-MAN-03",
        "L4-MAN-04"
      ],
      "min_memory_gib": 4,
      "min_cpus": 2
    },
    "iam-cp": {
      "services": [
        "keycloak",
        "iam-db",
        "cp",
        "cp-db",
        "probe"
      ],
      "mandatory": [
        "L4-IAM-01",
        "L4-IAM-02",
        "L4-CP-01",
        "L4-CP-02",
        "L4-CP-03"
      ],
      "min_memory_gib": 8,
      "min_cpus": 4,
      "pins_file": "int02/lock.json",
      "status": "CANDIDATE_UNVERIFIED"
    }
  },
  "simulators": [],
  "contains_real_legal_actors": false,
  "contains_production_credentials": false
}
